{
  "eventId": "ddt-20260919-0",
  "promotionSlug": "ddt",
  "name": "越後バックドロップ",
  "series": null,
  "date": "2026-09-19",
  "doorsOpen": "12:00",
  "bellTime": "13:00",
  "venueSlug": "niigata-higashi-ku-plaza",
  "attendance": null,
  "confirmed": true,
  "matches": [
    {
      "order": 1,
      "segment": "card",
      "matchType": "tag",
      "sides": [
        {
          "wrestlerIds": [
            "hideki-okatani",
            "ilusion"
          ],
          "teamName": null
        },
        {
          "wrestlerIds": [
            "to-y",
            "yuni"
          ],
          "teamName": null
        }
      ],
      "titleName": null,
      "timeLimitMinutes": 15,
      "result": {
        "winnerSideIndex": 0,
        "decision": "unknown",
        "finishMoveSlug": null,
        "durationSeconds": 483
      },
      "confirmed": true,
      "notes": null
    },
    {
      "order": 2,
      "segment": "card",
      "matchType": "six-man-tag",
      "sides": [
        {
          "wrestlerIds": [
            "junta-miyawaki",
            "viento-levante",
            "daichi-satoh"
          ],
          "teamName": null
        },
        {
          "wrestlerIds": [
            "jun-akiyama",
            "akito",
            "masami-inahata"
          ],
          "teamName": null
        }
      ],
      "titleName": null,
      "timeLimitMinutes": 15,
      "result": {
        "winnerSideIndex": 0,
        "decision": "pinfall",
        "finishMoveSlug": null,
        "durationSeconds": 608
      },
      "confirmed": true,
      "notes": null
    },
    {
      "order": 3,
      "segment": "card",
      "matchType": "multi-man",
      "sides": [
        {
          "wrestlerIds": [
            "daisuke-sasaki",
            "mj-paul"
          ],
          "teamName": null
        },
        {
          "wrestlerIds": [
            "chris-brookes",
            "hinata-kasai"
          ],
          "teamName": null
        },
        {
          "wrestlerIds": [
            "takeshi-masada",
            "yuya-koroku"
          ],
          "teamName": null
        }
      ],
      "titleName": null,
      "timeLimitMinutes": 30,
      "result": {
        "winnerSideIndex": 2,
        "decision": "unknown",
        "finishMoveSlug": null,
        "durationSeconds": 503
      },
      "confirmed": true,
      "notes": null
    },
    {
      "order": 4,
      "segment": "card",
      "matchType": "tag",
      "sides": [
        {
          "wrestlerIds": [
            "yuki-ueno",
            "shunma-katsumata"
          ],
          "teamName": null
        },
        {
          "wrestlerIds": [
            "yuki-ishida",
            "kazuma-sumi"
          ],
          "teamName": null
        }
      ],
      "titleName": null,
      "timeLimitMinutes": 30,
      "result": {
        "winnerSideIndex": 0,
        "decision": "pinfall",
        "finishMoveSlug": null,
        "durationSeconds": 771
      },
      "confirmed": true,
      "notes": "※¡Hasta la vista!"
    },
    {
      "order": 6,
      "segment": "card",
      "matchType": "singles",
      "sides": [
        {
          "wrestlerIds": [
            "harashima"
          ],
          "teamName": null
        },
        {
          "wrestlerIds": [
            "super-sasadango-machine"
          ],
          "teamName": null
        }
      ],
      "titleName": null,
      "timeLimitMinutes": 30,
      "result": {
        "winnerSideIndex": 0,
        "decision": "pinfall",
        "finishMoveSlug": null,
        "durationSeconds": 807
      },
      "confirmed": true,
      "notes": "※蒼魔刀"
    }
  ],
  "officialUrl": "https://www.ddtpro.jp/schedules/6a322a8ef72276000253f983",
  "sources": [
    {
      "url": "https://www.ddtpro.jp/schedules/6a322a8ef72276000253f983",
      "title": "越後バックドロップ | ddt",
      "retrievedAt": "2026-08-31"
    },
    {
      "url": "https://www.ddtpro.jp/results/6aade9bf9a0af70002bc9dbb",
      "title": "越後バックドロップ | ddt",
      "retrievedAt": "2026-09-19"
    }
  ]
}
