{
  "eventId": "njpw-20260916-0",
  "promotionSlug": "njpw",
  "name": "NJPW BATTLE LINE HOKKAIDO ～Road to DESTRUCTION～",
  "series": null,
  "date": "2026-09-16",
  "doorsOpen": "17:30",
  "bellTime": "18:30",
  "venueSlug": "hokkaido-tomakomai-gymnasium",
  "attendance": 772,
  "confirmed": true,
  "matches": [
    {
      "order": 1,
      "segment": "card",
      "matchType": "tag",
      "sides": [
        {
          "wrestlerIds": [
            "yushin-hatazawa",
            "ryusuke-taguchi"
          ],
          "teamName": null
        },
        {
          "wrestlerIds": [
            "dick-togo",
            "shun-skywalker"
          ],
          "teamName": null
        }
      ],
      "titleName": null,
      "timeLimitMinutes": 20,
      "result": {
        "winnerSideIndex": 1,
        "decision": "pinfall",
        "finishMoveSlug": null,
        "durationSeconds": 548
      },
      "confirmed": true,
      "notes": null
    },
    {
      "order": 2,
      "segment": "card",
      "matchType": "tag",
      "sides": [
        {
          "wrestlerIds": [
            "masatora-yasuda",
            "el-desperado"
          ],
          "teamName": null
        },
        {
          "wrestlerIds": [
            "sho",
            "douki"
          ],
          "teamName": null
        }
      ],
      "titleName": null,
      "timeLimitMinutes": 20,
      "result": {
        "winnerSideIndex": 1,
        "decision": "pinfall",
        "finishMoveSlug": null,
        "durationSeconds": 541
      },
      "confirmed": true,
      "notes": null
    },
    {
      "order": 3,
      "segment": "card",
      "matchType": "eight-man-tag",
      "sides": [
        {
          "wrestlerIds": [
            "taisei-nakahara",
            "master-wato",
            "boltin-oleg",
            "shota-umino"
          ],
          "teamName": null
        },
        {
          "wrestlerIds": [
            "jacob-austin-young",
            "jake-lee",
            "great-o-khan",
            "henare"
          ],
          "teamName": null
        }
      ],
      "titleName": null,
      "timeLimitMinutes": 20,
      "result": {
        "winnerSideIndex": 1,
        "decision": "pinfall",
        "finishMoveSlug": null,
        "durationSeconds": 764
      },
      "confirmed": true,
      "notes": null
    },
    {
      "order": 4,
      "segment": "card",
      "matchType": "tag",
      "sides": [
        {
          "wrestlerIds": [
            "daiki-nagai",
            "jeff-cobb"
          ],
          "teamName": null
        },
        {
          "wrestlerIds": [
            "zane-jay",
            "callum-newman"
          ],
          "teamName": null
        }
      ],
      "titleName": null,
      "timeLimitMinutes": 30,
      "result": {
        "winnerSideIndex": 0,
        "decision": "pinfall",
        "finishMoveSlug": null,
        "durationSeconds": 503
      },
      "confirmed": true,
      "notes": null
    },
    {
      "order": 5,
      "segment": "card",
      "matchType": "six-man-tag",
      "sides": [
        {
          "wrestlerIds": [
            "taichi",
            "yuya-uemura",
            "wolf-aron"
          ],
          "teamName": null
        },
        {
          "wrestlerIds": [
            "hartley-jackson",
            "ryohei-oiwa",
            "kosei-fujita"
          ],
          "teamName": null
        }
      ],
      "titleName": null,
      "timeLimitMinutes": 30,
      "result": {
        "winnerSideIndex": 1,
        "decision": "pinfall",
        "finishMoveSlug": null,
        "durationSeconds": 626
      },
      "confirmed": true,
      "notes": null
    },
    {
      "order": 6,
      "segment": "card",
      "matchType": "six-man-tag",
      "sides": [
        {
          "wrestlerIds": [
            "jado",
            "toru-yano",
            "togi-makabe"
          ],
          "teamName": null
        },
        {
          "wrestlerIds": [
            "gedo",
            "oskar",
            "yuto-ice"
          ],
          "teamName": null
        }
      ],
      "titleName": null,
      "timeLimitMinutes": 30,
      "result": null,
      "confirmed": true,
      "notes": null
    },
    {
      "order": 7,
      "segment": "card",
      "matchType": "eight-man-tag",
      "sides": [
        {
          "wrestlerIds": [
            "tatsuya-matsumoto",
            "yoshi-hashi",
            "yoh",
            "hirooki-goto"
          ],
          "teamName": null
        },
        {
          "wrestlerIds": [
            "robbie-x",
            "shingo-takagi",
            "taiji-ishimori",
            "yota-tsuji"
          ],
          "teamName": null
        }
      ],
      "titleName": null,
      "timeLimitMinutes": 30,
      "result": {
        "winnerSideIndex": 1,
        "decision": "submission",
        "finishMoveSlug": null,
        "durationSeconds": 942
      },
      "confirmed": true,
      "notes": null
    }
  ],
  "officialUrl": "https://www.njpw.co.jp/tournament/card/657036",
  "sources": [
    {
      "url": "https://www.njpw.co.jp/tournament/card/657036",
      "title": "NJPW BATTLE LINE HOKKAIDO ～Road to DESTRUCTION～ | njpw",
      "retrievedAt": "2026-08-31"
    },
    {
      "url": "https://www.njpw.co.jp/tournament/result/657036",
      "title": "NJPW BATTLE LINE HOKKAIDO ～Road to DESTRUCTION～ | njpw",
      "retrievedAt": "2026-10-04"
    }
  ]
}
