{
  "eventId": "ddt-20261114-0",
  "promotionSlug": "ddt",
  "name": "ハマのリングで愛を叫べ！2026",
  "series": null,
  "date": "2026-11-14",
  "doorsOpen": "12:00",
  "bellTime": "13:00",
  "venueSlug": "yokohama-radiant-hall",
  "attendance": null,
  "confirmed": true,
  "officialUrl": "https://www.ddtpro.jp/schedules/6a8289a20151fa0002c8df18",
  "sources": [
    {
      "url": "https://www.ddtpro.jp/schedules/6a8289a20151fa0002c8df18",
      "title": "ハマのリングで愛を叫べ！2026 | DDTプロレスリング",
      "retrievedAt": "2026-10-18"
    }
  ],
  "matches": []
}
