{
  "eventId": "njpw-20260910-0",
  "promotionSlug": "njpw",
  "name": "Road to DESTRUCTION",
  "series": null,
  "date": "2026-09-10",
  "doorsOpen": "17:30",
  "bellTime": "18:30",
  "venueSlug": "tokyo-korakuen-hall",
  "attendance": 1218,
  "confirmed": true,
  "matches": [
    {
      "order": 1,
      "segment": "dark",
      "matchType": "singles",
      "sides": [
        {
          "wrestlerIds": [
            "taisei-nakahara"
          ],
          "teamName": null
        },
        {
          "wrestlerIds": [
            "yushin-hatazawa"
          ],
          "teamName": null
        }
      ],
      "titleName": null,
      "timeLimitMinutes": 10,
      "result": {
        "winnerSideIndex": 0,
        "decision": "pinfall",
        "finishMoveSlug": null,
        "durationSeconds": 409
      },
      "confirmed": true,
      "notes": null
    },
    {
      "order": 1,
      "segment": "card",
      "matchType": "eight-man-tag",
      "sides": [
        {
          "wrestlerIds": [
            "masatora-yasuda",
            "master-wato",
            "boltin-oleg",
            "yuya-uemura"
          ],
          "teamName": null
        },
        {
          "wrestlerIds": [
            "jacob-austin-young",
            "jake-lee",
            "great-o-khan",
            "henare"
          ],
          "teamName": null
        }
      ],
      "titleName": null,
      "timeLimitMinutes": 20,
      "result": {
        "winnerSideIndex": 1,
        "decision": "pinfall",
        "finishMoveSlug": null,
        "durationSeconds": 748
      },
      "confirmed": true,
      "notes": null
    },
    {
      "order": 2,
      "segment": "card",
      "matchType": "tag",
      "sides": [
        {
          "wrestlerIds": [
            "gedo",
            "jeff-cobb"
          ],
          "teamName": null
        },
        {
          "wrestlerIds": [
            "zane-jay",
            "callum-newman"
          ],
          "teamName": null
        }
      ],
      "titleName": null,
      "timeLimitMinutes": 20,
      "result": {
        "winnerSideIndex": 1,
        "decision": "pinfall",
        "finishMoveSlug": null,
        "durationSeconds": 585
      },
      "confirmed": true,
      "notes": null
    },
    {
      "order": 3,
      "segment": "card",
      "matchType": "six-man-tag",
      "sides": [
        {
          "wrestlerIds": [
            "jado",
            "toru-yano",
            "togi-makabe"
          ],
          "teamName": null
        },
        {
          "wrestlerIds": [
            "daiki-nagai",
            "oskar",
            "yuto-ice"
          ],
          "teamName": null
        }
      ],
      "titleName": null,
      "timeLimitMinutes": 20,
      "result": {
        "winnerSideIndex": null,
        "decision": "draw",
        "finishMoveSlug": null,
        "durationSeconds": 296
      },
      "confirmed": true,
      "notes": null
    },
    {
      "order": 4,
      "segment": "card",
      "matchType": "tag",
      "sides": [
        {
          "wrestlerIds": [
            "tatsuya-matsumoto",
            "yoh"
          ],
          "teamName": null
        },
        {
          "wrestlerIds": [
            "robbie-x",
            "taiji-ishimori"
          ],
          "teamName": null
        }
      ],
      "titleName": null,
      "timeLimitMinutes": 30,
      "result": {
        "winnerSideIndex": 1,
        "decision": "pinfall",
        "finishMoveSlug": null,
        "durationSeconds": 510
      },
      "confirmed": true,
      "notes": null
    },
    {
      "order": 5,
      "segment": "card",
      "matchType": "six-man-tag",
      "sides": [
        {
          "wrestlerIds": [
            "ryusuke-taguchi",
            "shota-umino",
            "el-desperado"
          ],
          "teamName": null
        },
        {
          "wrestlerIds": [
            "shun-skywalker",
            "sho",
            "douki"
          ],
          "teamName": null
        }
      ],
      "titleName": null,
      "timeLimitMinutes": 30,
      "result": {
        "winnerSideIndex": 1,
        "decision": "pinfall",
        "finishMoveSlug": null,
        "durationSeconds": 571
      },
      "confirmed": true,
      "notes": null
    },
    {
      "order": 6,
      "segment": "card",
      "matchType": "tag",
      "sides": [
        {
          "wrestlerIds": [
            "yoshi-hashi",
            "hirooki-goto"
          ],
          "teamName": null
        },
        {
          "wrestlerIds": [
            "shingo-takagi",
            "yota-tsuji"
          ],
          "teamName": null
        }
      ],
      "titleName": null,
      "timeLimitMinutes": 30,
      "result": {
        "winnerSideIndex": 1,
        "decision": "pinfall",
        "finishMoveSlug": null,
        "durationSeconds": 1084
      },
      "confirmed": true,
      "notes": null
    },
    {
      "order": 7,
      "segment": "card",
      "matchType": "tag",
      "sides": [
        {
          "wrestlerIds": [
            "taichi",
            "wolf-aron"
          ],
          "teamName": null
        },
        {
          "wrestlerIds": [
            "kosei-fujita",
            "ryohei-oiwa"
          ],
          "teamName": null
        }
      ],
      "titleName": null,
      "timeLimitMinutes": 30,
      "result": {
        "winnerSideIndex": 1,
        "decision": "pinfall",
        "finishMoveSlug": "german-suplex-hold",
        "durationSeconds": 1265
      },
      "confirmed": true,
      "notes": null
    }
  ],
  "officialUrl": "https://www.njpw.co.jp/tournament/card/654876",
  "sources": [
    {
      "url": "https://www.njpw.co.jp/tournament/card/654876",
      "title": "Road to DESTRUCTION | njpw",
      "retrievedAt": "2026-08-31"
    },
    {
      "url": "https://www.njpw.co.jp/tournament/result/654876",
      "title": "Road to DESTRUCTION | njpw",
      "retrievedAt": "2026-10-04"
    }
  ]
}
