{
  "eventId": "njpw-20261109-0",
  "promotionSlug": "njpw",
  "name": "”ガス” PE invitational",
  "series": null,
  "date": "2026-11-09",
  "doorsOpen": "18:00",
  "bellTime": "19:00",
  "venueSlug": "tokyo-shinkiba-1st-ring",
  "attendance": null,
  "confirmed": true,
  "officialUrl": "https://www.njpw.co.jp/schedule",
  "sources": [
    {
      "url": "https://www.njpw.co.jp/schedule",
      "title": "スケジュール | 新日本プロレス",
      "retrievedAt": "2026-10-18"
    }
  ],
  "matches": []
}
