{
  "eventId": "stardom-20270116-0",
  "promotionSlug": "stardom",
  "name": "大会名未定",
  "series": null,
  "date": "2027-01-16",
  "doorsOpen": null,
  "bellTime": null,
  "venueSlug": "tokushima-asty-tokushima",
  "attendance": null,
  "confirmed": true,
  "officialUrl": "https://wwr-stardom.com/schedule/?ym=202701",
  "sources": [
    {
      "url": "https://x.com/wwr_stardom/status/2112463135189975420",
      "title": "スターダム公式X 2027年1月の日程",
      "retrievedAt": "2026-10-22"
    },
    {
      "url": "https://wwr-stardom.com/schedule/?ym=202701",
      "title": "スターダム スケジュール 2027年1月",
      "retrievedAt": "2026-10-22"
    }
  ],
  "matches": []
}
