{
  "eventId": "njpw-20261124-0",
  "promotionSlug": "njpw",
  "name": "WORLD TAG LEAGUE 2026",
  "series": "WORLD TAG LEAGUE 2026",
  "date": "2026-11-24",
  "doorsOpen": "17:30",
  "bellTime": "18:30",
  "venueSlug": "koriyama-big-palette-fukushima",
  "attendance": null,
  "confirmed": true,
  "officialUrl": "https://www.njpw.co.jp/schedule",
  "sources": [
    {
      "url": "https://www.njpw.co.jp/schedule",
      "title": "スケジュール | 新日本プロレス",
      "retrievedAt": "2026-10-18"
    }
  ],
  "matches": []
}
