{
  "eventId": "ddt-20261001-0",
  "promotionSlug": "ddt",
  "name": "MUSCLE＆",
  "series": null,
  "date": "2026-10-01",
  "doorsOpen": "17:30",
  "bellTime": "18:30",
  "venueSlug": "tokyo-korakuen-hall",
  "attendance": null,
  "confirmed": true,
  "matches": [
    {
      "order": 1,
      "segment": "card",
      "matchType": "singles",
      "sides": [
        {
          "wrestlerIds": [
            "yuni"
          ],
          "teamName": null
        },
        {
          "wrestlerIds": [
            "yuki-ishida"
          ],
          "teamName": null
        }
      ],
      "titleName": null,
      "timeLimitMinutes": 10,
      "result": {
        "winnerSideIndex": 0,
        "decision": "pinfall",
        "finishMoveSlug": null,
        "durationSeconds": 422
      },
      "confirmed": true,
      "notes": "※フェニックス・スプラッシュ 片エビ固め"
    },
    {
      "order": 2,
      "segment": "card",
      "matchType": "tag",
      "sides": [
        {
          "wrestlerIds": [
            "to-y",
            "ilusion"
          ],
          "teamName": null
        },
        {
          "wrestlerIds": [
            "yuya-koroku",
            "masami-inahata"
          ],
          "teamName": null
        }
      ],
      "titleName": null,
      "timeLimitMinutes": 10,
      "result": {
        "winnerSideIndex": 0,
        "decision": "pinfall",
        "finishMoveSlug": null,
        "durationSeconds": 431
      },
      "confirmed": true,
      "notes": "※トイシオンキック 片エビ固め"
    },
    {
      "order": 3,
      "segment": "card",
      "matchType": "tag",
      "sides": [
        {
          "wrestlerIds": [
            "el-desperado",
            "viento-levante"
          ],
          "teamName": null
        },
        {
          "wrestlerIds": [
            "yuki-ueno",
            "kazuma-sumi"
          ],
          "teamName": null
        }
      ],
      "titleName": null,
      "timeLimitMinutes": 10,
      "result": {
        "winnerSideIndex": 0,
        "decision": "pinfall",
        "finishMoveSlug": null,
        "durationSeconds": 596
      },
      "confirmed": true,
      "notes": "上野“BADASS”勇希は上野勇希のギミック表記。横入り式エビ固め"
    },
    {
      "order": 4,
      "segment": "card",
      "matchType": "singles",
      "sides": [
        {
          "wrestlerIds": [
            "kanon"
          ],
          "teamName": null
        },
        {
          "wrestlerIds": [
            "daichi-satoh"
          ],
          "teamName": null
        }
      ],
      "titleName": null,
      "timeLimitMinutes": 10,
      "result": {
        "winnerSideIndex": null,
        "decision": "time-limit-draw",
        "finishMoveSlug": null,
        "durationSeconds": null
      },
      "confirmed": true,
      "notes": "時間切れ引き分け。"
    },
    {
      "order": 5,
      "segment": "card",
      "matchType": "tag",
      "sides": [
        {
          "wrestlerIds": [
            "takeshi-masada",
            "hinata-kasai"
          ],
          "teamName": null
        },
        {
          "wrestlerIds": [
            "hideki-okatani",
            "kaisei-takechi"
          ],
          "teamName": null
        }
      ],
      "titleName": null,
      "timeLimitMinutes": 10,
      "result": {
        "winnerSideIndex": 1,
        "decision": "pinfall",
        "finishMoveSlug": "vertical-drop-brainbuster",
        "durationSeconds": 566
      },
      "confirmed": true,
      "notes": "※垂直落下式ブレーンバスター"
    },
    {
      "order": 6,
      "segment": "card",
      "matchType": "multi-man",
      "sides": [
        {
          "wrestlerIds": [
            "mao"
          ],
          "teamName": null
        },
        {
          "wrestlerIds": [
            "takeshi-masada"
          ],
          "teamName": null
        },
        {
          "wrestlerIds": [
            "viento-levante"
          ],
          "teamName": null
        },
        {
          "wrestlerIds": [
            "hinata-kasai"
          ],
          "teamName": null
        }
      ],
      "titleName": "KO-D無差別級選手権",
      "timeLimitMinutes": 60,
      "result": {
        "winnerSideIndex": 0,
        "decision": "knockout",
        "finishMoveSlug": null,
        "durationSeconds": 1373
      },
      "confirmed": true,
      "notes": "サバイバル4WAY。第89代王者MAOが5度目の防衛。 居合いキック"
    }
  ],
  "officialUrl": "https://www.ddtpro.jp/results/6abe4007da0fc600023f1478",
  "sources": [
    {
      "url": "https://www.ddtpro.jp/schedules/6a94ed1db48fab00021f4e29",
      "title": "MUSCLE＆ | ddt",
      "retrievedAt": "2026-08-31"
    },
    {
      "url": "https://www.ddtpro.jp/results/6abe4007da0fc600023f1478",
      "title": "MUSCLE＆ | DDTプロレスリング",
      "retrievedAt": "2026-10-18"
    }
  ]
}
