{
  "eventId": "njpw-20260801-0",
  "promotionSlug": "njpw",
  "name": "新日カードランブル presents G1 CLIMAX 36",
  "series": null,
  "date": "2026-08-01",
  "doorsOpen": "15:30",
  "bellTime": "17:00",
  "venueSlug": "hiroshima-sunplaza-hall",
  "attendance": 2255,
  "confirmed": true,
  "matches": [
    {
      "order": 1,
      "segment": "card",
      "matchType": "tag",
      "sides": [
        {
          "wrestlerIds": [
            "tatsuya-matsumoto",
            "toru-yano"
          ],
          "teamName": null
        },
        {
          "wrestlerIds": [
            "zane-jay",
            "callum-newman"
          ],
          "teamName": null
        }
      ],
      "titleName": null,
      "timeLimitMinutes": 20,
      "result": {
        "winnerSideIndex": 1,
        "decision": "pinfall",
        "finishMoveSlug": null,
        "durationSeconds": 296
      },
      "confirmed": true,
      "notes": null
    },
    {
      "order": 2,
      "segment": "card",
      "matchType": "tag",
      "sides": [
        {
          "wrestlerIds": [
            "taisei-nakahara",
            "wolf-aron"
          ],
          "teamName": null
        },
        {
          "wrestlerIds": [
            "daiki-nagai",
            "drilla-moloney"
          ],
          "teamName": null
        }
      ],
      "titleName": null,
      "timeLimitMinutes": 20,
      "result": {
        "winnerSideIndex": 1,
        "decision": "pinfall",
        "finishMoveSlug": null,
        "durationSeconds": 476
      },
      "confirmed": true,
      "notes": null
    },
    {
      "order": 3,
      "segment": "card",
      "matchType": "tag",
      "sides": [
        {
          "wrestlerIds": [
            "masatora-yasuda",
            "yuya-uemura"
          ],
          "teamName": null
        },
        {
          "wrestlerIds": [
            "dick-togo",
            "ren-narita"
          ],
          "teamName": null
        }
      ],
      "titleName": null,
      "timeLimitMinutes": 20,
      "result": {
        "winnerSideIndex": 1,
        "decision": "pinfall",
        "finishMoveSlug": null,
        "durationSeconds": 285
      },
      "confirmed": true,
      "notes": null
    },
    {
      "order": 4,
      "segment": "card",
      "matchType": "tag",
      "sides": [
        {
          "wrestlerIds": [
            "gedo",
            "oskar"
          ],
          "teamName": null
        },
        {
          "wrestlerIds": [
            "hartley-jackson",
            "zack-sabre-jr"
          ],
          "teamName": null
        }
      ],
      "titleName": null,
      "timeLimitMinutes": 20,
      "result": {
        "winnerSideIndex": 1,
        "decision": "pinfall",
        "finishMoveSlug": null,
        "durationSeconds": 313
      },
      "confirmed": true,
      "notes": null
    },
    {
      "order": 5,
      "segment": "card",
      "matchType": "singles",
      "sides": [
        {
          "wrestlerIds": [
            "boltin-oleg"
          ],
          "teamName": null
        },
        {
          "wrestlerIds": [
            "sanada"
          ],
          "teamName": null
        }
      ],
      "titleName": null,
      "timeLimitMinutes": 30,
      "result": {
        "winnerSideIndex": 0,
        "decision": "pinfall",
        "finishMoveSlug": null,
        "durationSeconds": 90
      },
      "confirmed": true,
      "notes": null
    },
    {
      "order": 6,
      "segment": "card",
      "matchType": "singles",
      "sides": [
        {
          "wrestlerIds": [
            "yuto-ice"
          ],
          "teamName": null
        },
        {
          "wrestlerIds": [
            "jake-lee"
          ],
          "teamName": null
        }
      ],
      "titleName": null,
      "timeLimitMinutes": 30,
      "result": {
        "winnerSideIndex": 0,
        "decision": "pinfall",
        "finishMoveSlug": null,
        "durationSeconds": 637
      },
      "confirmed": true,
      "notes": null
    },
    {
      "order": 7,
      "segment": "card",
      "matchType": "singles",
      "sides": [
        {
          "wrestlerIds": [
            "shingo-takagi"
          ],
          "teamName": null
        },
        {
          "wrestlerIds": [
            "great-o-khan"
          ],
          "teamName": null
        }
      ],
      "titleName": null,
      "timeLimitMinutes": 30,
      "result": {
        "winnerSideIndex": 0,
        "decision": "pinfall",
        "finishMoveSlug": null,
        "durationSeconds": 596
      },
      "confirmed": true,
      "notes": null
    },
    {
      "order": 8,
      "segment": "card",
      "matchType": "singles",
      "sides": [
        {
          "wrestlerIds": [
            "yota-tsuji"
          ],
          "teamName": null
        },
        {
          "wrestlerIds": [
            "ryohei-oiwa"
          ],
          "teamName": null
        }
      ],
      "titleName": null,
      "timeLimitMinutes": 30,
      "result": {
        "winnerSideIndex": 0,
        "decision": "pinfall",
        "finishMoveSlug": null,
        "durationSeconds": 1177
      },
      "confirmed": true,
      "notes": null
    },
    {
      "order": 9,
      "segment": "card",
      "matchType": "singles",
      "sides": [
        {
          "wrestlerIds": [
            "hirooki-goto"
          ],
          "teamName": null
        },
        {
          "wrestlerIds": [
            "konosuke-takeshita"
          ],
          "teamName": null
        }
      ],
      "titleName": null,
      "timeLimitMinutes": 30,
      "result": {
        "winnerSideIndex": 1,
        "decision": "pinfall",
        "finishMoveSlug": null,
        "durationSeconds": 1084
      },
      "confirmed": true,
      "notes": null
    }
  ],
  "officialUrl": "https://www.njpw.co.jp/tournament/result/642498",
  "sources": [
    {
      "url": "https://www.njpw.co.jp/tournament/result/642498",
      "title": "新日カードランブル presents G1 CLIMAX 36 | njpw",
      "retrievedAt": "2026-08-22"
    }
  ]
}
