{
  "eventId": "njpw-20260718-0",
  "promotionSlug": "njpw",
  "name": "新日カードランブル presents G1 CLIMAX 36",
  "series": null,
  "date": "2026-07-18",
  "doorsOpen": "15:30",
  "bellTime": "17:00",
  "venueSlug": "sapporo-hokkaido-prefectural-sports-center",
  "attendance": 2555,
  "confirmed": true,
  "matches": [
    {
      "order": 1,
      "segment": "card",
      "matchType": "tag",
      "sides": [
        {
          "wrestlerIds": [
            "tatsuya-matsumoto",
            "wolf-aron"
          ],
          "teamName": null
        },
        {
          "wrestlerIds": [
            "taisei-nakahara",
            "toru-yano"
          ],
          "teamName": null
        }
      ],
      "titleName": null,
      "timeLimitMinutes": 20,
      "result": {
        "winnerSideIndex": 0,
        "decision": "pinfall",
        "finishMoveSlug": null,
        "durationSeconds": 314
      },
      "confirmed": true,
      "notes": null
    },
    {
      "order": 2,
      "segment": "card",
      "matchType": "tag",
      "sides": [
        {
          "wrestlerIds": [
            "zane-jay",
            "callum-newman"
          ],
          "teamName": null
        },
        {
          "wrestlerIds": [
            "dick-togo",
            "ren-narita"
          ],
          "teamName": null
        }
      ],
      "titleName": null,
      "timeLimitMinutes": 20,
      "result": {
        "winnerSideIndex": 1,
        "decision": "pinfall",
        "finishMoveSlug": null,
        "durationSeconds": 394
      },
      "confirmed": true,
      "notes": null
    },
    {
      "order": 3,
      "segment": "card",
      "matchType": "tag",
      "sides": [
        {
          "wrestlerIds": [
            "masatora-yasuda",
            "yuya-uemura"
          ],
          "teamName": null
        },
        {
          "wrestlerIds": [
            "hartley-jackson",
            "zack-sabre-jr"
          ],
          "teamName": null
        }
      ],
      "titleName": null,
      "timeLimitMinutes": 20,
      "result": {
        "winnerSideIndex": 1,
        "decision": "pinfall",
        "finishMoveSlug": null,
        "durationSeconds": 476
      },
      "confirmed": true,
      "notes": null
    },
    {
      "order": 4,
      "segment": "card",
      "matchType": "singles",
      "sides": [
        {
          "wrestlerIds": [
            "drilla-moloney"
          ],
          "teamName": null
        },
        {
          "wrestlerIds": [
            "gabe-kidd"
          ],
          "teamName": null
        }
      ],
      "titleName": null,
      "timeLimitMinutes": 30,
      "result": {
        "winnerSideIndex": 0,
        "decision": "pinfall",
        "finishMoveSlug": null,
        "durationSeconds": 946
      },
      "confirmed": true,
      "notes": null
    },
    {
      "order": 5,
      "segment": "card",
      "matchType": "singles",
      "sides": [
        {
          "wrestlerIds": [
            "great-o-khan"
          ],
          "teamName": null
        },
        {
          "wrestlerIds": [
            "sanada"
          ],
          "teamName": null
        }
      ],
      "titleName": null,
      "timeLimitMinutes": 30,
      "result": {
        "winnerSideIndex": 0,
        "decision": "countout",
        "finishMoveSlug": null,
        "durationSeconds": 670
      },
      "confirmed": true,
      "notes": null
    },
    {
      "order": 6,
      "segment": "card",
      "matchType": "singles",
      "sides": [
        {
          "wrestlerIds": [
            "konosuke-takeshita"
          ],
          "teamName": null
        },
        {
          "wrestlerIds": [
            "jake-lee"
          ],
          "teamName": null
        }
      ],
      "titleName": null,
      "timeLimitMinutes": 30,
      "result": {
        "winnerSideIndex": 0,
        "decision": "pinfall",
        "finishMoveSlug": null,
        "durationSeconds": 531
      },
      "confirmed": true,
      "notes": null
    },
    {
      "order": 7,
      "segment": "card",
      "matchType": "singles",
      "sides": [
        {
          "wrestlerIds": [
            "boltin-oleg"
          ],
          "teamName": null
        },
        {
          "wrestlerIds": [
            "yuto-ice"
          ],
          "teamName": null
        }
      ],
      "titleName": null,
      "timeLimitMinutes": 30,
      "result": {
        "winnerSideIndex": 0,
        "decision": "knockout",
        "finishMoveSlug": null,
        "durationSeconds": 901
      },
      "confirmed": true,
      "notes": null
    },
    {
      "order": 8,
      "segment": "card",
      "matchType": "singles",
      "sides": [
        {
          "wrestlerIds": [
            "shingo-takagi"
          ],
          "teamName": null
        },
        {
          "wrestlerIds": [
            "ryohei-oiwa"
          ],
          "teamName": null
        }
      ],
      "titleName": null,
      "timeLimitMinutes": 30,
      "result": {
        "winnerSideIndex": 0,
        "decision": "pinfall",
        "finishMoveSlug": null,
        "durationSeconds": 997
      },
      "confirmed": true,
      "notes": null
    },
    {
      "order": 9,
      "segment": "card",
      "matchType": "singles",
      "sides": [
        {
          "wrestlerIds": [
            "hirooki-goto"
          ],
          "teamName": null
        },
        {
          "wrestlerIds": [
            "yota-tsuji"
          ],
          "teamName": null
        }
      ],
      "titleName": null,
      "timeLimitMinutes": 30,
      "result": {
        "winnerSideIndex": 0,
        "decision": "pinfall",
        "finishMoveSlug": null,
        "durationSeconds": 1355
      },
      "confirmed": true,
      "notes": null
    }
  ],
  "officialUrl": "https://www.njpw.co.jp/tournament/result/642266",
  "sources": [
    {
      "url": "https://www.njpw.co.jp/tournament/result/642266",
      "title": "新日カードランブル presents G1 CLIMAX 36 | njpw",
      "retrievedAt": "2026-08-22"
    }
  ]
}
